{
  "rule_version": "point-rubric-20260922-v1",
  "run_id": "E-cuda-kimi-k3-2-standard-20260921T104600",
  "process_sha256": "de981e72021f2ac371f861ba732ab373f168b33c5c22abacc4bb6332a4d97319",
  "metrics": {
    "M1": {
      "status": "scored",
      "score": 2,
      "reason": "第二次查询首次命中官方PyTorch环境变量文档。",
      "evidence": [
        {
          "event_id": "WebSearch_0_69031dca.result",
          "quote": "# Search Results for \"PyTorch CUDA error device-side assert triggered 定位 CUDA_LAUNCH_BLOCKING compute-sanitizer\"\n\n## 1. [PyTorch训练报错‘CUDA error: device-side assert triggered ...](https://blog.csdn.net/weixin_42652674/article/details/160732746)\n\n2 天之前 · 本文详细解析了PyTorch训练中常见的‘CUDA error: device-side assert triggered’报错问题，重点介绍了如何使 …\n\n**URL:** https://blog.csdn.net/weixin_42652674/article/details/160732746\n\n---\n\n## 2. [PyTorch训练报错‘CUDA device-side assert triggered’？别慌 ...](https://blog.csdn.net/weixi"
        }
      ]
    },
    "M2": {
      "status": "scored",
      "score": 4,
      "reason": "official fetch documents scored independently and averaged",
      "evidence": [
        {
          "event_id": "WebFetch_3_24a7da31.result",
          "quote": "# Compute Sanitizer 手册概述章节提取结果\n\n**说明**：以下为 NVIDIA Compute Sanitizer 官方文档概述（Introduction）章节的直接正文。由于源内容在 \"Example Use of Memcheck\" 部分被截断（截断点见文末说明），**本回答为概述章节的完整内容 + 部分相关补充，示例章节仅为部分内容**。\n\n---\n\n## 1. Compute Sanitizer 的用途\n\n### About Compute Sanitizer（原文）\n\n> \"Compute Sanitizer is a functional correctness checking suite included in the CUDA toolkit. This suite contains multiple tools that can perform different type of checks. The memcheck tool is capable of precisely detecting and attributing out of b"
        },
        {
          "event_id": "WebFetch_4_874f91bf.result",
          "quote": "**标题**: CUDA Environment Variables — PyTorch 2.14 documentation\n\n/docs/1.7.0/cuda_environment_variables.html)v1.6.0v1.5.1v1.5.0v1.4.0v1.3.1v1.3.0v1.2.0v1.1.0v1.0.1v1.0.0v0.4.1v0.4.0v0.3.1v0.3.0v0.2.0v0.1.12\n\n[...]\n\n- torch.utils.model_zoo\n  - torch.utils.tensorboard\n  - torch.utils.module_tracker\n  - Type Info\n  - torch.config\n  - torch.__future__\n  - torch._logging\n  - Torch Environment Variables\n- Developer Notes\n\n[...]\n\n# CUDA Environment Variables#\n\n# CUDA Environment Variables#\nCreated On: "
        }
      ],
      "documents": [
        {
          "id": "https://docs.nvidia.com/compute-sanitizer/ComputeSanitizer/index.html",
          "status": "scored",
          "score": 3,
          "observations": {
            "representation": "excerpt",
            "completeness_verification": "not_independently_verified"
          }
        },
        {
          "id": "https://pytorch.org/docs/stable/cuda_environment_variables.html",
          "status": "scored",
          "score": 5,
          "observations": {
            "representation": "body",
            "completeness_verification": "not_independently_verified"
          }
        }
      ]
    },
    "M3": {
      "status": "scored",
      "score": 3,
      "reason": "核心定位kernel实际输出/源码位置的方法有说明，但DSA构建与示例细节不足。",
      "evidence": [
        {
          "event_id": "WebFetch_3_24a7da31.result",
          "quote": "### 基本调用格式（原文）\n\n```\ncompute-sanitizer [options] app_name [app_options]\n```\n\n### 各子工具的调用示例（原文）\n\n**Memcheck（默认启用，也可显式指定）：**\n```\ncompute-sanitizer --tool memcheck [sanitizer_options] app_name [app_options]\n```\n\n**Racecheck：**\n```\ncompute-sanitizer --tool racecheck [sanitizer_options] app_name [app_options]\n```\n\n**Initcheck：**\n```\ncompute-sanitizer --tool initcheck [sanitizer_options] app_name [app_options]\n```\n\n**Synccheck：**\n```\ncompute-sanitizer --tool synccheck [sanitizer_options] app_name [app_options]\n```\n\n### 命令行选项格式说明（原文）\n\n> \"Command line options can be specified to `co"
        },
        {
          "event_id": "WebFetch_3_24a7da31.result",
          "quote": "## 5. 截断说明\n\n- 源内容在 **\"Compute Sanitizer Tool Examples → Example Use of Memcheck → `memcheck_demo` Output with Memcheck (Release Build)\"** 小节处被截断。最后可见的文字为：\n  > \"…Though the kernel name and error type are detected, there is no line number information on the failing kernel. Also included in the output are the host and device backtraces for the call sites where the functions were launched\"（随后标记 `[content truncated]`）\n- 因此：**概述章节（Introduction）正文完整无截断**；命令行选项表（Table 1–6）在源内容中完整；**示例章节（memcheck_demo 的完整输出演示）缺失后半部分**（包括 Release Build 完整输出、带 `-lineinfo` 的输出、各工具示例等后续内容）。\n- 示例程序获取位置（文档中提及，完整保留）：[compute-sanitizer github repository](https://git"
        }
      ]
    },
    "M4": {
      "status": "scored",
      "score": 3,
      "reason": "partial version/applicability relations; required compatibility mapping remains missing",
      "evidence": [
        {
          "event_id": "WebFetch_3_24a7da31.result",
          "quote": "Compute Sanitizer is installed as part of the CUDA toolkit."
        },
        {
          "event_id": "WebFetch_4_874f91bf.result",
          "quote": "**标题**: CUDA Environment Variables — PyTorch 2.14 documentation\n\n/docs/1.7.0/cuda_env"
        }
      ]
    },
    "M5": {
      "status": "scored",
      "score": 5,
      "reason": "At least six independent diagnostic content groups. Same-title reproduction candidates enumerated, official manual copy excluded; generic snippet does not erase relevant DSA article title.",
      "evidence": [
        {
          "event_id": "WebSearch_0_69031dca.result",
          "quote": "## 1. [PyTorch训练报错‘CUDA error: device-side assert triggered ...](https://blog.csdn.net/weixin_42652674/article/details/160732746)\n\n2 天之前 · 本文详细解析了PyTorch训练中常见的‘CUDA error: device-side assert triggered’报错问题，重点介绍了如何使 …\n\n**URL:** https://blog.csdn.net/weixin_42652674/article/details/160732746\n\n---\n\n"
        }
      ],
      "observations": {
        "possible_counts": [
          9,
          10,
          11
        ]
      }
    },
    "M6": {
      "status": "scored",
      "score": 3,
      "reason": "异步与同步主张有独立支持；精确栈、性能和部分OS步骤无支持，完成核查后为部分支持。",
      "evidence": [
        {
          "event_id": "WebFetch_6_9fa657e2.result",
          "quote": "CUDA的设计哲学是追求极致性能，这直接导致了其异步执行特性。当GPU内核函数发生错误时，错误报告可能会延迟到后续某个 API调用 时才抛出。这种设计在正常情况下能提高吞吐量，但在调试时却成了噩梦。\n\n典型的异步错误特征包括：\n\n- 报错位置与实际错误发生点不一致\n- 错误信息含糊不清（如\"device-side assert triggered\"）\n- 堆栈跟踪指向无关的API调用点\n\n**关键诊断指标**：\n\n`"
        },
        {
          "event_id": "WebFetch_4_874f91bf.result",
          "quote": "`CUDA_LAUNCH_BLOCKING`\n\nIf set to `1`, makes CUDA calls synchronous. This can be useful for debugging.\n\n`CUBLAS_WOR"
        },
        {
          "event_id": "WebFetch_5_163af38e.result",
          "quote": "Compile with `TORCH_USE_CUDA_DSA` to enable device-side assertions. - 知乎\n**发布时"
        }
      ]
    },
    "M7": {
      "status": "unscorable",
      "score": null,
      "reason": "先验同步/memcheck片段正确，但DSA默认构建、ARCH列表行号、Nsight等关键断言未能由固定包完全核清。",
      "evidence": [
        {
          "event_id": "client-note-00005",
          "quote": "3. 用 PyTorch 的 TORCH_USE_CUDA_DSA：需要**用源码编译 PyTorch** 并开启该编译选项（`TORCH_USE_CUDA_DSA=1`），device-side assert 才会带上 kernel 名和源码位置；官方 pip/conda 预编译包默认不开。这一点我记得是这样，但官方文档对当前版本的表述需核实。\n4. 常见触发源：分类标签越界（CrossEntropyLoss / NLLLoss 的 target 不在 "
        },
        {
          "event_id": "client-note-00005",
          "quote": "6. 用 `cuda-gdb` 或 Nsight Compute 做 kernel 级调试（较低层，通常非首选）。\n7. 编译 debug 版 kernels（`-g -G` / `TORCH_CUDA_ARCH_LIST`、debug build）可让 sanitizer 报出行号。\n\n**不确定处：**\n- compute-sanitizer 的确切命令行参数与输出格式细节（需查 CUDA 官方文档核实）。\n- TORCH_USE_"
        }
      ]
    },
    "M8": {
      "status": "scored",
      "score": 2,
      "reason": "Actual3 search+4 fetch dispatches=7, score2.",
      "event_refs": [
        "WebSearch_0_69031dca.dispatch",
        "WebSearch_1_056139e1.dispatch",
        "WebSearch_2_8ac7628b.dispatch",
        "WebFetch_3_24a7da31.dispatch",
        "WebFetch_4_874f91bf.dispatch",
        "WebFetch_5_163af38e.dispatch",
        "WebFetch_6_9fa657e2.dispatch"
      ]
    },
    "M9": {
      "status": "scored",
      "score": 3,
      "reason": "当前Compute Sanitizer/CUDA toolkit文档存在，但不能推出所有PyTorch 2.x与CUDA耦合关系。",
      "evidence": [
        {
          "event_id": "run-end",
          "quote": "### 版本适用性\n\n- `CUDA_LAUNCH_BLOCKING=1`：PyTorch 官方稳定版文档（2.14，含历史版本选择器，长期存在）记载，适用于当前 PyTorch 2.x；不依赖特定小版本。\n- `compute-sanitizer`：CUDA Toolkit 自带（CUDA 11.x 起替代旧 cuda-memcheck，存档文档 11.2.0 已存在），随 toolkit 版本走，与 PyTorch 版本无耦合。\n- `TORCH_USE_CUDA_DSA`：官方文档未查得版本说明（见上\"不确定处\"）。\n\n### 来源\n\n- 官方：NVIDIA Compute Sanitizer 用户手册 https://docs.nvidia.com/compute-sanitizer/ComputeSanitizer/index.html （概述章节正文完整取得；memcheck 示例章节被工具截断，截断点已注明）\n- 官方：PyTorch"
        }
      ]
    },
    "M10": {
      "status": "scored",
      "score": 3,
      "reason": "最终答案的DSA源码构建缺具体步骤，需内容补写；其余环境字段替换不单独造成3。",
      "evidence": [
        {
          "event_id": "run-end",
          "quote": "### 方法三：TORCH_USE_CUDA_DSA（需源码编译 PyTorch）\n\n报错信息原文即提示 \"Compile with `TORCH_USE_CUDA_DSA` to enable device-side assertions\"——即官方预编译 wheel 默认关闭 device-side assertion 详细输出；用源码编译并定义该宏后，assert 会带上更详细信息。**不确定处**：本轮检索未取得 PyTorch 官方文档对该编译选项的独立说明页，该结论仅依据报错提示文本与社区一致说法，官方出处未核实。\n\n### 方法四：配合手段缩小范围\n\n1. **CPU 复现**：同一输入放 CPU 跑一遍，CPU 路径的索引检查在 Python 层，直接报精确出错行（社区通用做法，官方未核实）。\n2. **看 assert 文本与 kernel 名**：报错常带类似"
        },
        {
          "event_id": "run-end",
          "quote": "1. TORCH_USE_CUDA_DSA 的官方文档说明与确切编译步骤（仅有报错提示文本与社区说法）。\n2. CUDA_LAUNCH_BLOCKING 对性能影响的量化（官方页未写）。\n3"
        }
      ]
    },
    "M11": {
      "status": "unscorable",
      "score": null,
      "reason": "M7为unscorable，综合指数缺少有效先验输入。",
      "missing_inputs": [
        "M7"
      ]
    }
  },
  "observations": {
    "draft_source": "bounded executor adjudication"
  },
  "channel_states": {}
}
